{
  "fixtureMetadata":{"fixtureType":"synthetic","historical":false,"nonCallable":true,"sanitized":true,"sourceArtifact":"M8 Phase 2 synthetic test design","sourceArtifactRevision":"v1","fixtureSchemaVersion":"openart-fixture-v0.1"},
  "adapterVersion":"openart-adapter-v0.1","provider":"OpenArt","canonicalCapability":"TEXT_TO_IMAGE","requestedMode":"SYNTHETIC_TEXT_TO_IMAGE","submittedMode":null,"observedMode":null,"providerDisplayModeRaw":null,"providerStatusRaw":null,"normalizedStatus":"CREATED","historyId":null,"resourceId":null,"requestedSettingsJson":{"fixture":true},"actualSettingsJson":{},"estimateCost":"80","actualCost":null,"costUnit":"PROVIDER_CREDIT","outputCountExpected":1,"outputCountObserved":0,"failureCode":"OPENART_COST_CAP_EXCEEDED","failureMessage":"Synthetic estimate exceeds 75-credit connectivity ceiling"
}
