{
  "fixtureMetadata":{"fixtureType":"synthetic","historical":false,"nonCallable":true,"sanitized":true,"sourceArtifact":"M8 Phase 2 synthetic test design","sourceArtifactRevision":"v1","fixtureSchemaVersion":"openart-fixture-v0.1"},
  "adapterVersion":"openart-adapter-v0.1","provider":"OpenArt","canonicalCapability":"TEXT_TO_IMAGE","requestedMode":"SYNTHETIC_TEXT_TO_IMAGE","submittedMode":"SYNTHETIC_TEXT_TO_IMAGE","observedMode":null,"providerDisplayModeRaw":null,"providerStatusRaw":"submitted","normalizedStatus":"SUBMITTED","historyId":"SYNTHETIC-HISTORY-SUBMITTED","resourceId":null,"requestedSettingsJson":{"fixture":true},"actualSettingsJson":{},"estimateCost":"10","actualCost":null,"costUnit":"PROVIDER_CREDIT","outputCountExpected":1,"outputCountObserved":0,"failureCode":null,"failureMessage":null
}
